{
  "$schema": "https://json-schema.org/draft/2020-12/schema",
  "$id": "https://tao-spec.org/schemas/0.11.0/tao_mission_profile.schema.json",
  "title": "TAO Mission Profile",
  "description": "Structural schema for a TAO v0.11 Mission Profile. The override discipline (spec §7.3) is partly machine-checkable here (mapping_diff structure, weakening flags) and partly enforced by the reference validator (deviation report at validation time).",
  "type": "object",

  "required": ["profile_name", "profile_version", "profile_hash", "effective_date"],

  "properties": {
    "profile_name": { "type": "string", "minLength": 1 },
    "profile_version": { "type": "string", "pattern": "^\\d+\\.\\d+\\.\\d+$" },
    "profile_hash": { "type": "string", "pattern": "^sha256:[0-9a-fA-F]{64}$" },
    "effective_date": {
      "type": "string",
      "pattern": "^\\d{4}-\\d{2}-\\d{2}T\\d{2}:\\d{2}:\\d{2}\\.\\d{3,}Z$"
    },

    "verb_overrides": {
      "type": "object",
      "additionalProperties": { "$ref": "#/$defs/verb_override" }
    },

    "mapping_overrides": {
      "type": "object",
      "additionalProperties": { "$ref": "#/$defs/mapping_override" },
      "description": "Alternative REQUIRED/FORBIDDEN/PERMITTED mapping for one or more verbs. If present, mapping_diff MUST also be present."
    },

    "mapping_diff": {
      "type": "object",
      "additionalProperties": { "$ref": "#/$defs/mapping_diff_entry" },
      "description": "Machine-readable diff of mapping_overrides against the reference mapping in Appendix B. Required when mapping_overrides is present."
    },

    "escalation_chain": {
      "type": "array",
      "items": { "$ref": "#/$defs/escalation_step" }
    },

    "fail_safe_mode": {
      "type": "string",
      "enum": ["FAIL_CLOSED", "SAFE_STATE", "DEGRADE"]
    },

    "audit_retention": {
      "type": "string",
      "description": "ISO 8601 duration."
    },

    "authority": { "$ref": "#/$defs/authority" }
  },

  "allOf": [
    {
      "description": "mapping_overrides requires mapping_diff.",
      "if": { "required": ["mapping_overrides"] },
      "then": { "required": ["mapping_diff"] }
    }
  ],

  "additionalProperties": false,

  "$defs": {
    "verb_override": {
      "type": "object",
      "required": ["default"],
      "properties": {
        "default": {
          "type": "string",
          "enum": ["ALLOW", "BLOCK", "ESCALATE", "LOG"]
        },
        "exceptions": {
          "type": "array",
          "items": {
            "type": "object",
            "required": ["condition", "action"],
            "properties": {
              "condition": { "type": "string", "minLength": 1 },
              "action": {
                "type": "string",
                "enum": ["ALLOW", "BLOCK", "ESCALATE", "LOG"]
              },
              "escalation_role": { "type": "string" },
              "justification_required": { "type": "boolean" }
            }
          }
        }
      }
    },

    "mapping_override": {
      "type": "object",
      "properties": {
        "required_any_of": {
          "type": "array",
          "items": { "$ref": "#/$defs/effect_type" }
        },
        "forbidden": {
          "type": "array",
          "items": { "$ref": "#/$defs/effect_type" }
        },
        "permitted": {
          "type": "array",
          "items": { "$ref": "#/$defs/effect_type" }
        }
      },
      "additionalProperties": false
    },

    "mapping_diff_entry": {
      "type": "object",
      "required": ["added_required", "removed_required", "added_forbidden", "removed_forbidden", "added_permitted", "removed_permitted", "weakening"],
      "properties": {
        "added_required": { "type": "array", "items": { "$ref": "#/$defs/effect_type" } },
        "removed_required": { "type": "array", "items": { "$ref": "#/$defs/effect_type" } },
        "added_forbidden": { "type": "array", "items": { "$ref": "#/$defs/effect_type" } },
        "removed_forbidden": { "type": "array", "items": { "$ref": "#/$defs/effect_type" } },
        "added_permitted": { "type": "array", "items": { "$ref": "#/$defs/effect_type" } },
        "removed_permitted": { "type": "array", "items": { "$ref": "#/$defs/effect_type" } },
        "weakening": {
          "type": "boolean",
          "description": "TRUE if this override removes any REQUIRED effect, removes any FORBIDDEN effect, or moves an effect from FORBIDDEN to PERMITTED. See spec §7.3."
        },
        "weakening_rationale": {
          "type": "string",
          "description": "REQUIRED if weakening is TRUE."
        }
      },
      "allOf": [
        {
          "description": "A weakening override must carry a rationale.",
          "if": { "properties": { "weakening": { "const": true } }, "required": ["weakening"] },
          "then": { "required": ["weakening_rationale"] }
        }
      ],
      "additionalProperties": false
    },

    "effect_type": {
      "type": "string",
      "enum": [
        "RESOURCE.TRANSFER",
        "RESOURCE.DAMAGE",
        "CAPABILITY.RESTRICT",
        "CAPABILITY.ENABLE",
        "INFO.DISCLOSE",
        "INFO.WITHHOLD",
        "INFO.FABRICATE",
        "COMMITMENT.MAKE",
        "COMMITMENT.BREAK"
      ]
    },

    "escalation_step": {
      "type": "object",
      "required": ["role"],
      "properties": {
        "role": { "type": "string", "minLength": 1 },
        "timeout": { "type": "string", "description": "ISO 8601 duration." }
      }
    },

    "authority": {
      "type": "object",
      "required": ["signer_id", "signer_role", "signature", "signature_algorithm", "sequence_number"],
      "properties": {
        "signer_id": { "type": "string", "minLength": 1 },
        "signer_role": { "type": "string", "minLength": 1 },
        "signature": { "type": "string", "minLength": 1 },
        "signature_algorithm": {
          "type": "string",
          "enum": ["Ed25519", "ECDSA-P256", "RSA-PSS-3072"]
        },
        "certificate_chain": {
          "type": "array",
          "items": { "type": "string" }
        },
        "sequence_number": {
          "type": "integer",
          "minimum": 0
        }
      }
    }
  }
}
